{
  "schema_version": "heuristic_eval.review_task.v0",
  "checkpoint_id": "checkpoint_output_issue_0001",
  "return_to_run_id": "sample_character_output_run_001",
  "task_id": "task_output_0001",
  "task_type": "output_issue_review",
  "profile": "voice_clone_asset",
  "target_id": "sample_character_v2_reg_001",
  "audio_refs": {
    "output": "local://outputs/sample_character_v2/reg_001.wav"
  },
  "context": {
    "primary_auto_failure": "speed_regression",
    "secondary_auto_failures": [
      "pause_regression",
      "speaker_identity_drift"
    ]
  },
  "choices": [
    "usable",
    "needs_revision",
    "reject",
    "uncertain"
  ],
  "review_mode": "blind_first",
  "auto_signal_visibility": "collapsed",
  "allowed_tags": [
    "too_fast",
    "bad_pause",
    "unnatural",
    "unclear",
    "speaker_identity_drift",
    "character_style_drift",
    "pronunciation_issue"
  ],
  "tag_groups": [
    {
      "id": "issues",
      "label": "Issues",
      "label_zh": "问题标签",
      "tags": [
        "too_fast",
        "bad_pause",
        "unnatural",
        "unclear",
        "speaker_identity_drift",
        "character_style_drift",
        "pronunciation_issue"
      ]
    }
  ],
  "evidence_refs": [
    "regression_result.sample.json"
  ]
}
